{
  "categories": [
    {
      "accounting": {
        "arithmeticClosed": true,
        "excludedRecords": 0,
        "inScopeRecords": 20,
        "inputRecords": 20,
        "outOfScopeRecords": 0,
        "retainedRecords": 20,
        "unresolvedRecords": 0
      },
      "candidateCount": 14,
      "capturedAt": "2026-09-03T16:35:24Z",
      "categoryId": "debt_issuance",
      "metricType": "DEBT_ISSUED_PAR",
      "rows": [
        {
          "canonicalEntityId": "entity_5204a3d8f84bbfcd",
          "currency": "USD",
          "debtClasses": [
            "COFINA"
          ],
          "entityDisplayName": "Puerto Rico Sales Tax Financing Corporation",
          "entityId": "entity_5204a3d8f84bbfcd",
          "entityResolutionState": "CANONICAL_V1_ENTITY_ID",
          "entityType": "fund",
          "evidenceCount": 2,
          "financialValueState": "MEASURED_PAR_AMOUNT",
          "metricType": "DEBT_ISSUED_PAR",
          "metricValue": 16314000000,
          "rank": 1,
          "recordCount": 2
        },
        {
          "canonicalEntityId": "entity_125b538f289a4708",
          "currency": "USD",
          "debtClasses": [
            "GO"
          ],
          "entityDisplayName": "Commonwealth of Puerto Rico",
          "entityId": "entity_125b538f289a4708",
          "entityResolutionState": "CANONICAL_V1_ENTITY_ID",
          "entityType": "agency",
          "evidenceCount": 3,
          "financialValueState": "MEASURED_PAR_AMOUNT",
          "metricType": "DEBT_ISSUED_PAR",
          "metricValue": 11800000000,
          "rank": 2,
          "recordCount": 3
        },
        {
          "canonicalEntityId": "entity_b182f85acf46f69b",
          "currency": "USD",
          "debtClasses": [
            "HTA"
          ],
          "entityDisplayName": "Puerto Rico Highways and Transportation Authority",
          "entityId": "entity_b182f85acf46f69b",
          "entityResolutionState": "CANONICAL_V1_ENTITY_ID",
          "entityType": "agency",
          "evidenceCount": 2,
          "financialValueState": "MEASURED_PAR_AMOUNT",
          "metricType": "DEBT_ISSUED_PAR",
          "metricValue": 4108400000,
          "rank": 3,
          "recordCount": 2
        },
        {
          "canonicalEntityId": "entity_b14376987d82d5ee",
          "currency": "USD",
          "debtClasses": [
            "other"
          ],
          "entityDisplayName": "Puerto Rico Public Finance Corporation",
          "entityId": "entity_b14376987d82d5ee",
          "entityResolutionState": "CANONICAL_V1_ENTITY_ID",
          "entityType": "fund",
          "evidenceCount": 1,
          "financialValueState": "MEASURED_PAR_AMOUNT",
          "metricType": "DEBT_ISSUED_PAR",
          "metricValue": 1255000000,
          "rank": 4,
          "recordCount": 1
        },
        {
          "canonicalEntityId": "entity_6c1d858c1babe390",
          "currency": "USD",
          "debtClasses": [
            "PREPA"
          ],
          "entityDisplayName": "Puerto Rico Electric Power Authority",
          "entityId": "entity_6c1d858c1babe390",
          "entityResolutionState": "CANONICAL_V1_ENTITY_ID",
          "entityType": "utility",
          "evidenceCount": 2,
          "financialValueState": "MEASURED_PAR_AMOUNT",
          "metricType": "DEBT_ISSUED_PAR",
          "metricValue": 1193000000,
          "rank": 5,
          "recordCount": 2
        },
        {
          "canonicalEntityId": "entity_c5fb8a7f44e8ff18",
          "currency": "USD",
          "debtClasses": [
            "PRASA"
          ],
          "entityDisplayName": "Puerto Rico Aqueduct and Sewer Authority",
          "entityId": "entity_c5fb8a7f44e8ff18",
          "entityResolutionState": "CANONICAL_V1_ENTITY_ID",
          "entityType": "utility",
          "evidenceCount": 2,
          "financialValueState": "MEASURED_PAR_AMOUNT",
          "metricType": "DEBT_ISSUED_PAR",
          "metricValue": 1150000000,
          "rank": 6,
          "recordCount": 2
        },
        {
          "canonicalEntityId": "entity_d363e4ddf2ce6a5d",
          "currency": "USD",
          "debtClasses": [
            "other"
          ],
          "entityDisplayName": "Government Development Bank for Puerto Rico",
          "entityId": "entity_d363e4ddf2ce6a5d",
          "entityResolutionState": "CANONICAL_V1_ENTITY_ID",
          "entityType": "agency",
          "evidenceCount": 1,
          "financialValueState": "MEASURED_PAR_AMOUNT",
          "metricType": "DEBT_ISSUED_PAR",
          "metricValue": 900000000,
          "rank": 7,
          "recordCount": 1
        },
        {
          "canonicalEntityId": "entity_7cf79ff780fb8279",
          "currency": "USD",
          "debtClasses": [
            "other"
          ],
          "entityDisplayName": "Puerto Rico Infrastructure Financing Authority",
          "entityId": "entity_7cf79ff780fb8279",
          "entityResolutionState": "CANONICAL_V1_ENTITY_ID",
          "entityType": "agency",
          "evidenceCount": 1,
          "financialValueState": "MEASURED_PAR_AMOUNT",
          "metricType": "DEBT_ISSUED_PAR",
          "metricValue": 500000000,
          "rank": 8,
          "recordCount": 1
        },
        {
          "canonicalEntityId": "entity_2c16f9ae54df7e1e",
          "currency": "USD",
          "debtClasses": [
            "other"
          ],
          "entityDisplayName": "Puerto Rico Convention Center District Authority",
          "entityId": "entity_2c16f9ae54df7e1e",
          "entityResolutionState": "CANONICAL_V1_ENTITY_ID",
          "entityType": "agency",
          "evidenceCount": 1,
          "financialValueState": "MEASURED_PAR_AMOUNT",
          "metricType": "DEBT_ISSUED_PAR",
          "metricValue": 469900000,
          "rank": 9,
          "recordCount": 1
        },
        {
          "canonicalEntityId": "entity_cc41784f4b40b6ff",
          "currency": "USD",
          "debtClasses": [
            "other"
          ],
          "entityDisplayName": "University of Puerto Rico",
          "entityId": "entity_cc41784f4b40b6ff",
          "entityResolutionState": "CANONICAL_V1_ENTITY_ID",
          "entityType": "agency",
          "evidenceCount": 1,
          "financialValueState": "MEASURED_PAR_AMOUNT",
          "metricType": "DEBT_ISSUED_PAR",
          "metricValue": 359000000,
          "rank": 10,
          "recordCount": 1
        },
        {
          "canonicalEntityId": "entity_5f99300da364ea64",
          "currency": "USD",
          "debtClasses": [
            "other"
          ],
          "entityDisplayName": "Puerto Rico Industrial Development Company",
          "entityId": "entity_5f99300da364ea64",
          "entityResolutionState": "CANONICAL_V1_ENTITY_ID",
          "entityType": "agency",
          "evidenceCount": 1,
          "financialValueState": "MEASURED_PAR_AMOUNT",
          "metricType": "DEBT_ISSUED_PAR",
          "metricValue": 240000000,
          "rank": 11,
          "recordCount": 1
        },
        {
          "canonicalEntityId": "entity_efcec09764306ade",
          "currency": "USD",
          "debtClasses": [
            "other"
          ],
          "entityDisplayName": "Puerto Rico Ports Authority",
          "entityId": "entity_efcec09764306ade",
          "entityResolutionState": "CANONICAL_V1_ENTITY_ID",
          "entityType": "agency",
          "evidenceCount": 1,
          "financialValueState": "MEASURED_PAR_AMOUNT",
          "metricType": "DEBT_ISSUED_PAR",
          "metricValue": 220000000,
          "rank": 12,
          "recordCount": 1
        },
        {
          "canonicalEntityId": "entity_c6aa8887d7248228",
          "currency": "USD",
          "debtClasses": [
            "other"
          ],
          "entityDisplayName": "Puerto Rico Housing Finance Authority",
          "entityId": "entity_c6aa8887d7248228",
          "entityResolutionState": "CANONICAL_V1_ENTITY_ID",
          "entityType": "agency",
          "evidenceCount": 1,
          "financialValueState": "MEASURED_PAR_AMOUNT",
          "metricType": "DEBT_ISSUED_PAR",
          "metricValue": 180000000,
          "rank": 13,
          "recordCount": 1
        },
        {
          "canonicalEntityId": "entity_e73c9879d715653a",
          "currency": "USD",
          "debtClasses": [
            "other"
          ],
          "entityDisplayName": "Puerto Rico Municipal Finance Agency",
          "entityId": "entity_e73c9879d715653a",
          "entityResolutionState": "CANONICAL_V1_ENTITY_ID",
          "entityType": "agency",
          "evidenceCount": 1,
          "financialValueState": "MEASURED_PAR_AMOUNT",
          "metricType": "DEBT_ISSUED_PAR",
          "metricValue": 155000000,
          "rank": 14,
          "recordCount": 1
        }
      ],
      "runtimeManifest": {
        "files": [
          {
            "bytes": 7481,
            "path": "config/financial_category_ontology.json",
            "sha256": "e09186e0897c090761df8714d4372c35dd80490ce4e095915d6f790efa9fbb86"
          },
          {
            "bytes": 9145,
            "path": "server/backend/leaderboards.py",
            "sha256": "1fdfe50ad0e127cb26662f96b11a957cfe2357e9edc255436bd2b31e489b9e04"
          },
          {
            "bytes": 26453,
            "path": "server/backend/leaderboard_adapters.py",
            "sha256": "89e7605e9bd64dc9daed252dd8297f1ba7d80dc4164c2e8aac81d57d1e2a316f"
          },
          {
            "bytes": 10681,
            "path": "server/backend/leaderboard_history.py",
            "sha256": "9c32c4878742e56f038c39abe15140f5c0057bdea481e5f56dfed712d86247db"
          },
          {
            "bytes": 5939,
            "path": "server/backend/leaderboard_investigation.py",
            "sha256": "d5a68c990488436a9c068e0fb61a1f7c7b5efaf2ea312160a583867b063201c1"
          },
          {
            "bytes": 6125,
            "path": "server/backend/leaderboard_entities.py",